12	0.0, 0.98, 0.0	正品的质量很好，一体加绒，材质很好，很细致，颜色正，做工讲究，码数标准，天气凉了，薄款的过几天就可以
6	1.0, 0.0, 0.0	不错，很好的一次网
2	1.0, 0.0, 0.0	布料做工精细，尺码正好材质手感特别好，保暖性强，物美
0	1.0, 0.0, 0.0	都穿上了，不拍照片了，老品牌了，爸爸，我都很忠爱恒源祥，支持民族
2	1.0, 0.0, 0.0	质量很好、穿着舒服，国产品牌、支持国货。一次愉快的购物
11	1.0, 0.0, 0.0	质量不行，不
6	1.0, 0.0, 0.0	质量还可以吧穿着挺舒服的
11	1.0, 0.0, 0.0	商品盒有灰尘，而且不塑封，任何人都能
2	1.0, 0.0, 0.0	价格贵，价保时间短，尺寸偏小，容易向上跑，不值得购
2	1.0, 0.0, 0.0	太薄了，布薄的能看到人，质量太差
35	0.0, 0.0, 1.0	还好吧弹性不是很
35	0.0, 0.0, 1.0	其实很薄，不太舒
11	1.0, 0.0, 0.0	面料很好，上身效果好，穿着舒服，尺码标准，非常合身，物超所值
0	1.0, 0.0, 0.0	昨天买的套装，今天就到了，没想到这么快就到了。京东物流的速度很给力哦，试穿了下，材质很好，套装上身效果很好，摸起来也很舒服。很适合我这种喜欢跑步健身的人，舒适透气！这个季节穿正合适，夏天晚上还有些凉爽
18	0.0, 0.88, 0.01	衣服质感非常好，适合夏天穿很显白的衣服，值得推
14	0.0, 0.99, 0.0	衣服质量很好，跟照片一致，穿上去很舒服也很暖和，再也不怕冬天了，这是给我父母买的，我父亲穿上之后非常满意。京东的物流也很快，基本上发货到收到还是很方便的，尤其是物流小哥能够直接送到农村去，真的非常感
2	1.0, 0.0, 0.0	货品已经收到了，谢谢！物流很快，货品包装完好无损，产品质量不错。针角细密，体感舒适。很满
6	1.0, 0.0, 0.0	不好特
11	1.0, 0.0, 0.0	李宁体育用品，国货品牌，这款冰丝快干运动恤，我是第二次购买了，选择白色恤搭配，面料柔软透气轻薄，快干舒适透气，适合跑步散步户外活动时穿着。很好
2	1.0, 0.0, 0.0	真心不错，尺码标准，很合适，穿着也很舒服
6	1.0, 0.0, 0.0	与商品描述不符。说是加厚，但到手发现有
2	1.0, 0.0, 0.0	包装很漂亮，还赠送了礼盒，还有手提袋，可以送亲人，朋友！做工也很
2	1.0, 0.0, 0.0	穿上很舒服，尺寸也很合身，厚度刚刚好，材质柔软舒适，透气效果非常好，穿一整天身上也不会出现
23	0.22, 0.56, 0.22	不满意，好多线头，还有开线，发货慢，快递员服务态度也不好，很不
18	0.1, 0.79, 0.05	衣服掉毛严重，质
35	0.0, 0.0, 1.0	面料材质：好上身效果：很好舒适程度：非常
14	0.03, 0.97, 0.0	东西很薄，感觉不值，懒得退了，也就那
23	0.21, 0.56, 0.22	#，客服这是什么态度，上图自己看，店大欺客是吧，我第一次
2	1.0, 0.0, 0.0	内裤质量看去还可以，建议买大一号，比如身高170的，买175尺寸的，要是比较胖的小伙伴可以考虑180尺寸的，拆开要洗，有轻微褪
2	1.0, 0.0, 0.0	手感很好，做工很精细，超级
2	1.0, 0.0, 0.0	四个内裤尺寸却不一样，有两个
14	0.18, 0.66, 0.01	质量很好的，穿起来舒服，已经推荐朋友又买了两套，性价比高
18	0.0, 0.97, 0.0	这家的单件的真是太好用了，用了第一次就还想再用一次。拆开包装后惊艳到我了，这就是我想要的单件!真是一次愉快的购
11	1.0, 0.0, 0.0	刚到的恤，味道很大，我买的是速干的，感觉起来像棉的一样，都说安踏东西不好，在这方面李宁还不如安
2,6	1.0, 0.0, 0.0|1.0, 0.0, 0.0	买个裤衩竟然从广州发货 真
2	1.0, 0.0, 0.0	一星都不想给  清洗了几次还是掉色严重 直接扔掉了 感觉买了假货一样，还挂恒源祥的
2	1.0, 0.0, 0.0	哈哈，衣服非常好，有修身效
23	0.02, 0.85, 0.0	质量好，下次继续购买，真的不错，好喜欢，非常棒，好喜欢，下次继续购买，有弹力，舒服美观，非常薄，好看，下次继续购买，棒
2	1.0, 0.0, 0.0	第一次洗就退色了，是不是真品
14	0.31, 0.69, 0.0	衣服很
18	0.41, 0.56, 0.03	挺好的，喜欢在京东买
18	0.01, 0.95, 0.01	。。。。。。。。。。过得
23	0.25, 0.48, 0.27	非常差裤子起球，说好补尝还不
11	1.0, 0.0, 0.0	很薄，很薄，不是很厚，但是质量还可以，很薄，但是
23	0.21, 0.57, 0.22	感觉非常凉快，颜色很
6	1.0, 0.0, 0.0	跟图片不一样的图
18	0.0, 0.94, 0.0	多少有点掉
12	0.02, 0.86, 0.01	这也叫冰丝吗，完全就是抹
6	1.0, 0.0, 0.0	刚买身就掉价，。差
11	1.0, 0.0, 0.0	裤子收到物流速度没得说一个字快保暖效果
2	1.0, 0.0, 0.0	运动服质量很好，面料柔软透气性很好，车工精细，大小合适穿着舒服。值得购
14	0.0, 0.99, 0.01	一下子买了八套，送给老人特别合适！材质好，保
18	0.01, 0.66, 0.06	和商品描述的型号
2	1.0, 0.0, 0.0	很透气，天天打球洗！简直爱死这款衣
14	0.0, 0.95, 0.0	尺码不对太小没法穿，买回来先洗了几遍掉毛毛太严重
18	0.19, 0.47, 0.34	哎，不穿不知道，穿了不舒服啊。这叫什么立体裁
18	0.14, 0.57, 0.01	一到夏天就想出去跑跑，这套衣服是买的最满意的一款，不仅吸汗，穿着还凉快，关键是洗了之后不变形，干得也快，喜欢运动的话，买这款应该是非常不错的选择
14	0.0, 1.0, 0.0	内裤挺好舒适透气，建议购
3	1.0, 0.0, 0.0	根本就和商品不符，质量极差，也不是什么李宁品牌
2	1.0, 0.0, 0.0	裤子没有口袋很不方
18	0.04, 0.94, 0.01	面料材质：还行上身效果：一般舒适程度：一
14	0.01, 0.99, 0.0	超级差评，一样型号的两件衣服，有一件大了不止一个个型号，而且有污渍
18	0.0, 1.0, 0.0	深颜色的竟然掉色，浅颜色的看不出掉不掉色。都扔了。建议大家都不要买！
2	1.0, 0.0, 0.0	
18	0.04, 0.89, 0.01	货收到了，不怎么样。建议别
6	1.0, 0.0, 0.0	衣服布料很透气柔软不起球，做工完美摸着非常舒服贴身穿着很细腻不粗糙，尺码很标准，颜色也正。线头和衣缝针脚都很妥
23	0.23, 0.45, 0.31	很
2	1.0, 0.0, 0.0	京东也发错货！现在京东太让人失望了，还不如~
18	0.08, 0.76, 0.1	面料材质：布料穿上不舒服上身效果：一般化舒适程度：不好吸汗效果：
2	1.0, 0.0, 0.0	不错，下次继续买这
11	1.0, 0.0, 0.0	掉毛毛还
14	0.16, 0.84, 0.0	很显然设计师不知道男士喜欢宽松点的
2	1.0, 0.0, 0.0	买给老公的，比之前买的好像要薄一点，老公说穿起来挺舒服的，应该是纯棉的，摸起来挺柔软的，恒源祥的内裤买过很多次了，挺不
1	1.0, 0.0, 0.0	确实是大码，建议拍的时候大一号，我就是大一号买的，穿起来正
35	0.0, 0.0, 1.0	太薄了，而且长，不是特别满
6	1.0, 0.0, 0.0	衣服很好，非常有弹性，做工还是非常的不错，质量真的很满意，没有线头，面料手感很柔软，尺码也非常的准确，
11	1.0, 0.0, 0.0	为了跑步专门说买一套装备，我属于肉感型帅哥，身高，体重，穿上很合适，款式是自己喜欢的类型_简约时尚。面料很柔和，跑步爱好者的不二之选
14	0.1, 0.88, 0.01	质量非常好，做工精致，穿着舒
8	1.0, 0.0, 0.0	假货啊刚收到就发现商标掉了一块衣服料子也很差有味道皱皱巴
5	1.0, 0.0, 0.0	厚薄程度：太薄，与描述的不
23	0.29, 0.38, 0.33	东西特别好。老喜欢了。希望大家都来够
5	1.0, 0.0, 0.0	衣服非常不错全棉的柔软舒适，价格比实体店便宜多了，现在国产品牌真的比国外品牌好。相信李宁也一直会买李宁这个牌子，物流很快，店家服务也好
6	1.0, 0.0, 0.0	东西很好下次再买很舒
11	1.0, 0.0, 0.0	没有写的那么厚，有点掉色！！！！
11	1.0, 0.0, 0.0	说是加厚的我才买的，买回来发现好薄，跟一般的保暖内衣内裤的厚度还要薄一点的感觉，感觉被欺
2	1.0, 0.0, 0.0	码小了，170的最好买1
2	1.0, 0.0, 0.0	比老款贵，比老款多一层
11	1.0, 0.0, 0.0	这款恒源祥的秋裤摸着很舒服，穿上也很暖和。做工也不错。总体上很好。双十一做活动价格也很优惠。应该买两条就好了。推荐购
5	1.0, 0.0, 0.0	宝贝收到后很满意，外形颜色也很喜欢，挑选好多家，果然没看错，希望把好物分享给大家
11	1.0, 0.0, 0.0	刚到货，试了一下大小合适，但放到清水里面就褪色，差评
2	1.0, 0.0, 0.0	尺码大小：吃吗正合适实穿感受：这个布料太喜欢了，穿上去跟舒服，晾衣服的时候沾上粉尘，衣服一干一甩就把灰尘全甩下来
11	1.0, 0.0, 0.0	我拍的是一套黑色的，结果给我寄来上身是灰色的，下身是黑色的，无语，真马虎，差
11	1.0, 0.0, 0.0	本来感觉还凑合，衣服线头处理的很好，但洗了两次还是这样，掉色掉的特别厉害，没法给好评，瞬间一星都不想给实穿感受：收紧还可以尺码大小：感觉偏大，试穿后再做评
0	1.0, 0.0, 0.0	不是很好，比较薄还
18	0.03, 0.79, 0.05	差评，质量不行跟街边几块差不
11	1.0, 0.0, 0.0	尺码大小：合适做工细节：完美材质手感：较好厚薄程度：比
7	1.0, 0.0, 0.0	还行，还不错，物流也
35	0.0, 0.0, 1.0	挺好，175 66kg 刚刚好。尺码合适，也比较保暖，北京这边零下4到8&deg;也不觉得
11	1.0, 0.0, 0.0	纯棉？表示有点
18	0.04, 0.89, 0.02	质量没得说，跟专卖店一样，特别特别喜欢，而且价格优
2	1.0, 0.0, 0.0	外套尺码小拉链发硬容易起包不柔
2	1.0, 0.0, 0.0	东西不错，试过了，蛮可以的，很贴身，透气性能很好
6	1.0, 0.0, 0.0	质量差，第一次过水就洗不干净，洗的时候水里全是毛，绒绒的毛，过水好多次还是掉毛，从来没买这么差劲的
11	1.0, 0.0, 0.0	宝贝以收到，穿着特别的舒服，也不粘身也不起静电，真的是物超所
35	0.0, 0.0, 1.0	之前买了两套，稍微有点小，也没有做退货更换处理，后面又重新买了两套，整体感觉品质质量各方面还非常不错，一直对京东的产品都是比较
11	1.0, 0.0, 0.0	商品已收到,做工很精细,好评会继续关注,支持！支持
11	1.0, 0.0, 0.0	手感不错，二维码检查是正品，也是代工厂
0	1.0, 0.0, 0.0	裤子还行，衣服很小啊，我估计我得练两个月才能穿的上
24	0.0, 0.0, 1.0	衣服面料柔软舒适透气，速干衣非常棒，穿上帅气给个
6	1.0, 0.0, 0.0	码子小了，与我平时穿的不符
11	1.0, 0.0, 0.0	跟图片上差别有点大
11	1.0, 0.0, 0.0	手感柔软舒服，亲肤温
11	1.0, 0.0, 0.0	真的太喜欢了，面料很柔软，舒适，很亲肤，而且不紧绷，质感绝绝子，价格奈斯，不错哦⊙&forall;
11	1.0, 0.0, 0.0	挺好的;;很透气，很
18	0.0, 0.98, 0.02	这个黄边疏忽了，真是要多丑有多丑，像办公的衙
12	0.08, 0.72, 0.0	双大腿有点潮湿，感觉不太舒服，一看起来吸汗不是那
6	1.0, 0.0, 0.0	衣服收到，试穿一下非常合身，十分舒适
18	0.35, 0.62, 0.02	保暖内衣看了看几家还是选择了恒源祥，虽然贵点但是质量有保障啊，回来拆开包裹一看一摸觉得质量与价格是成正比的。加绒的毛毛非常光滑贴身衣服要的就是舒适感，满
6	1.0, 0.0, 0.0	买的白色拿到之后颜色不一样，真差
23	0.22, 0.55, 0.23	质量太差！，越穿越大，越穿越宽。卖东西要有良
18	0.05, 0.91, 0.02	我去，这质量，薄的不得了，而且透光，李宁衣服就这质量？严重怀疑这衣服的真假
18	0.03, 0.81, 0.03	质量不错，穿上很舒服，价廉物美，一次很愉快的购物，有机会还会去关注和购买。希望店家生意兴隆
2	1.0, 0.0, 0.0	衣服很好，有弹性，支持国
18	0.19, 0.76, 0.04	跑步还没有自己的专用装备，看了不少，最后买了这款李宁的，感觉是正品，穿着透气，衣服料子软软的穿着非常舒服，价格不贵，性价比非常高这个价位非常不错了，做工很精细，颜色非常好看，尺码穿着正合适，非常喜欢，好东西，值得购
23	0.23, 0.53, 0.25	裤子很快收到，手感柔软舒适，应该还不错的吧。洗一水再穿。版型还是不错的。至于杀菌作用这一下就不好说了&hellip;&hellip;看穿后效果。快递速
11	1.0, 0.0, 0.0	我都不想来评价了，之前在你们家买的四角裤侧边都是没有缝线的，结果这次到货穿上才发现四角裤两侧都有缝线，真的是硌肉硌得慌，以后不敢在你们家
3	1.0, 0.0, 0.0	正品，质量很好，穿着很合适，舒服，面料很好，款式好看，喜欢
2	1.0, 0.0, 0.0	卖家服务好，发货快，物流也给力！纯棉的，舒适透气，吸汗，物美价廉，孩子很喜欢
2	1.0, 0.0, 0.0	买秋衣裤还真的是恒源祥的，这家店铺质量真的可靠，质量无可挑剔啊，很好穿，特意回来好评一
11	1.0, 0.0, 0.0	裤子一般吧，，，说不上
35	0.0, 0.0, 1.0	做工比较好，价格实惠，性价比很高。内层面料不管是摸上去还是穿上身都很舒服，细
6	1.0, 0.0, 0.0	很薄很柔软，穿着很舒服
0	1.0, 0.0, 0.0	面料柔软不褪色吆，穿着很舒服好看吁，尺码标准，穿着刚好，面料舒适透
23	0.29, 0.36, 0.35	不错，手感尺寸都很多错，运动用，性价比
2	1.0, 0.0, 0.0	品牌产品质量很好，京东快递非
11	1.0, 0.0, 0.0	不德绒，吊牌写的是暖绒，不要
11	1.0, 0.0, 0.0	很合神物流也很快面料很舒
11	1.0, 0.0, 0.0	很
0	1.0, 0.0, 0.0	?商品收到了，包装得很好，物流非常快，客服态度很积极，有问题及时解答！总体来说非常满
2,6	1.0, 0.0, 0.0|1.0, 0.0, 0.0	衣服到了，打开看衣服质量很好，上身试穿效果也不错，凉快，透气，喜欢及
18	0.0, 0.69, 0.0	衣服标签是贴上去的，洗了几次掉没了
18	0.01, 0.85, 0.0	恒源祥的内衣质量都很好，穿着很舒服，很保暖，第一次洗有一点点掉颜色，后面就还好不
8	1.0, 0.0, 0.0	做工精细，质量
2	1.0, 0.0, 0.0	老公很喜欢，因为他太瘦了，所以小号穿着都感觉有点宽宽的，质量挺好的，摸着可舒
11	1.0, 0.0, 0.0	尺码大小：偏小，一下买了两个颜色的两条，这个就偏瘦做工细节：没啥细节，天安门口有点大材质手感：柔软舒适保暖效果：还行，厚度在这，不可能太暖和厚薄程度：适中透气效果：
8	1.0, 0.0, 0.0	质量一般，有些薄，价格也变化太大一百多到七
2	1.0, 0.0, 0.0	尺码大小刚刚好吧，款式类型很时尚，很潮流呜，帮儿子买的儿子穿上很帅气。我也很高兴
2	1.0, 0.0, 0.0	运动套装质量很好，码数合适，款式好看，穿着好看舒服，很满意，非常喜欢
0	1.0, 0.0, 0.0	保暖效果不咋行，本来觉得恒源祥的应该不错，结果还不如南极
18	0.0, 0.97, 0.0	大品牌！值得信赖的！效果超级好！贵有贵的道理！很棒的商品
11	1.0, 0.0, 0.0	快递太暴力了，袋子破破烂烂的，盒子都破了，我如何送人？？
2	1.0, 0.0, 0.0	裤子收到了，因为是外地调货，9号下单，13号才收到货。比之前买的其它品牌的同型号内裤腰偏大。水洗标上是95%的
2	1.0, 0.0, 0.0	这也不厚牙，是不是发
2	1.0, 0.0, 0.0	终于收到货了，非常非常喜欢，做工精致漂亮，已经被很多人夸了，真的太开心了，已经是他家的忠实粉丝了，以后还会继续买买买的真的好喜欢，客服态度也挺好的，值！以后有需要还会来买宝贝非常棒，是自己想要的那种风格，到货也很快，谢谢老板，服务五颗星真的推荐啊，快递速度特别的快，爱了爱了宝贝很好，不得不说，客服态度也太好了吧！东西质量还可以，快递速度也很给力质量很好，收到货第一时间打开看了，很不错，很满意包装很好，质量非常棒，宝贝完全符合卖家的描述，可以放心购买?感谢??大品牌！值得信赖！效果超级好！贵有贵的道理！很棒的商品！性价比很高，很实惠，使用起来感觉很好，非常完美.^?^.商品收到咯，特别喜欢，一收到就迫不及待地打开了，家人也很满意，这次购物体验不错商品收到咯，特别喜欢，一收到就迫不及待地打开了，家人也很满意，这次购物体验不错包装非常结实，东西保护得很好，值得好评发货快，包装严实，商品质量非常好，比专柜便宜很多，客服服务态度也特别好，好评发货快，包装严实，商品质量非常好，比专柜便宜很多，客服服务态度也特别好，好评?已经多次购买了，家庭必备，购买价格实惠，送货速度很快，?包装也很精
2	1.0, 0.0, 0.0	刚好今天到了，看预报明天要降温，刚好能赶上，质量也很好，试了一下，穿着很舒
12	0.01, 0.86, 0.0	第好几次买恒源祥的内裤了，老品牌，穿着也挺舒服
6	1.0, 0.0, 0.0	短袖穿上很轻便，质量很好，没有色
11	1.0, 0.0, 0.0	很正的白色，性价比高，面料厚实，也挺特别的，很适合初夏穿，老公，穿有种小小的感觉，挺不错的
8	1.0, 0.0, 0.0	买了两条一个黑色的一个灰的感觉还可以膝盖的地方有加厚冬天穿俺也够用了，两个来回串性价比还是比较高的，毕竟价格在
7	1.0, 0.0, 0.0	质量不好给看的不一
23	0.25, 0.48, 0.27	东西很喜欢，质量也很好的，这个价格能买到是真的很划算物流很快，质感很好，很漂亮，很喜欢真的很好，性价比也很高，质量也很好，物流也快啊！一天就到货了！不错，喜欢，性价比高，以后会经常光顾宝贝真不错，做的真细心，值得拥有，快递很快一次很好的购物体验，服务周到，物流快速，配送也很周到，态度也很好，好
18	0.21, 0.7, 0.02	款式非常好看。质量挺好的。发货速度也快。尺码大小正合适。穿起来很舒服
12	0.0, 0.95, 0.03	有一种被忽悠的感觉，买了京东这么多的产品，这次是最不称心的，一点都没加厚，薄
12	0.23, 0.45, 0.02	下水褪色，清4次还是
11	1.0, 0.0, 0.0	挺合适的，要是护膝处再宽点就更好
6	1.0, 0.0, 0.0	尺码大小：175保暖效果：今天试穿了一下，很保暖，在工地上班，山洞里面，温度为4-7摄氏度，穿上以后一整天没冷过厚薄程度：较厚透气效果：一般般，出汗以后还是不容易干，保暖衣的通病
18	0.01, 0.95, 0.0	穿在身上清凉舒适，穿上运动装很有型，支持李宁品牌
35	0.0, 0.0, 1.0	保暖内衣看着很不错，一共买了两套，一款厚一点的一款薄一点的，温度不一样的时候穿，感觉很
2	1.0, 0.0, 0.0	穿着大小正合适，料子很舒服，做工很精致，手感很柔软，买内衣就认准恒源祥。我身高176，体重128.拍的170，合适仅供
6	1.0, 0.0, 0.0	面料材质：的聚酯纤维，的棉；上身效果：十分合适，既不紧身，又不宽松；舒适程度：面料轻薄，柔软，和皮肤亲和度很高，很舒服；吸汗效果：吸汗排汗效果好，适合运动穿着；身材体型：适合东方人体型，尺码和宣传的一致；其他特色：此款是黑色，不如墨蓝色耐看，胸前正中韦德的相当帅酷
11	1.0, 0.0, 0.0	买了两次，第一次还可以，第二次的衣服和第一次的衣服材料根本不一样，质量很担
23	0.25, 0.48, 0.27	根据商家推荐的尺码购买后，尺码不合适小了 商家一直强调穿洗不能退换 不试怎么知道合不合适？再者说当时是根据你给推荐的尺码购买
0	1.0, 0.0, 0.0	和我买的颜色不一
11	1.0, 0.0, 0.0	再次回购，还是同样的品牌，同样的店同样的产品，再次选购还是有不一样的感觉，秋冬季节需要的保暖内衣都有了，冬天就会感觉热乎乎了。一次一套两套的选都是很不错的。送人和自己穿都会非常得不错，感觉上就是非常得不错的。很有一种冬天暖，屋里热乎的一种体验。推荐很棒，京东自营的放心购，直接都不用特别得去想，直接就选了，非常得方便，也是非常得方便，直接选择好就可以很好地去取就可以了，自营的物流也是非常得好，通知到了就可以过去取
12	0.28, 0.67, 0.02	非常感谢友友的衣服，谢谢老
11	1.0, 0.0, 0.0	说实话，衣服就是比秋衣秋裤加了一层薄绒，指望这个过冬的话，就别想了，开春在穿也行，主要问题是做工，特别粗糙，线头真的特别多，不知道这牌子为什么这
35	0.0, 0.0, 1.0	还行吧，还比较满
35	0.0, 0.0, 1.0	不错 家里人穿的舒服 这个品牌 值得
11	1.0, 0.0, 0.0	建议买小两码真的大挺舒服
11	1.0, 0.0, 0.0	卖家服务很可以物流也可以，没想到包装这么细心。实
11	1.0, 0.0, 0.0	到货就迫不及待打开了，还行吧一
6	1.0, 0.0, 0.0	京东物流很快，东西质量非常棒，先行好评
0	1.0, 0.0, 0.0	**&hellip;衣服不好不透气，袖子很短&hellip;裤腿也很短&hellip;偷工减料。客服态度也很
18	0.01, 0.99, 0.0	还可以，面料摸着很舒服，清
14	0.01, 0.99, 0.01	穿了一次才评价的，面料很舒服，穿着很合适，以前从来都不在网上买衣服的，这次买的觉得非常好，是正
3	1.0, 0.0, 0.0	试穿了一下，感觉还不错！！！！！！！！！！！！希望洗过一次还是可以使用！！！！！！！！！！！加了绒，感觉是有点薄，不知道保暖效果咋样！！！材质手感：摸上去还挺舒服
14	0.0, 1.0, 0.0	黑色的这布料有点差啊，洗几遍了穿着还掉黑色布渣，穿着身上还
2	1.0, 0.0, 0.0	很舒服，这个衣服我觉得挺好
23	0.27, 0.42, 0.31	东西不错，便宜实惠，多穿着
11	1.0, 0.0, 0.0	感觉太薄了，不应该算是保暖裤，应该算是一个加了绒的秋裤，与想象中的相差
11	1.0, 0.0, 0.0	配送速度非
6	1.0, 0.0, 0.0	有点差，比较容易粘棉
35	0.0, 0.0, 1.0	衣服很快就收到了，做工和质量都不错，很喜欢，穿上很漂亮。谢谢店家送的小礼物，果断好评
5	1.0, 0.0, 0.0	衣服挺好的，晚上跑步穿着很舒服。期待套装里再出个鞋。全套的多好
4	1.0, 0.0, 0.0	到现在也没收到货，就显示完成交易，
12	0.0, 0.97, 0.02	很好非常满意，以后还会光顾，放心选购，非常推荐
18	0.02, 0.64, 0.03	恒源祥保暖内衣，秋季内衣服装，一直都是很好的选择，大品牌，质量有保证，只要想买保暖内衣，都会选择恒源祥，如果价格能再优惠些。就更
6	1.0, 0.0, 0.0	，少发了一件短裤，墨迹半天说商家没少发，硬是没有补发，我不知道京东怎么允许这种商家存在，发了一大堆数据给我说商家没少发，作为消费者一点招也没
35	0.0, 0.0, 1.0	质量不好。都起
11	1.0, 0.0, 0.0	物流快，服务态度好。质量很好。穿着很舒服，极力推荐
2	1.0, 0.0, 0.0	掉色严重，不
12	0.0, 0.99, 0.0	穿了一晚上起球了
18	0.01, 0.87, 0.01	布料柔软，尺寸也合适，穿着舒适。京东送货很快，即便广州疫情防控期间也能相对准时送达，赞一个。上身效果照片就不放上来了，商品与介绍一
3	1.0, 0.0, 0.0	恒源祥抗菌内裤，95%棉就这一条就值得购买。平角裤男士穿起来非常舒服，纯棉比较亲肤。恒源祥一如既往包装很好，颜色偏深，非常适合中学生穿。价格便宜，物流快服务
35	0.0, 0.0, 1.0	质量超好，柔软度也特别好，这下冷的时候再也不担
6	1.0, 0.0, 0.0	松松垮垮的，买完还
18	0.04, 0.7, 0.25	这质量太差了，一点弹性
14	0.01, 0.97, 0.01	跟实体店没有区别，还便宜，喜欢！物超所值，非常满意，期间有点小插曲，店家细致周到的服务让人很感动，祝生意兴隆，还会再来外观干净漂亮，做工很不错，没发现什么瑕疵，个人感觉大小也挺合适，找了很久选的这款，大
35	0.0, 0.0, 1.0	非常????上身效果：穿上身体试了一下，版型好看，上身好好看!很哇塞?!薄厚很适合这个炎热的夏天，非常透气，而且容易干爽!舒服?面料品质：今天到的货，下午下班拿到手，打开摸了一下，布料超级舒服，薄厚很适合这个炎热的夏天
23	0.0, 1.0, 0.0	京东物流是真的没话说，衣服包装得也很好，规规整整的，圆领设计比较喜欢，黑色确实是很百搭了，五星满意
35	0.0, 0.0, 1.0	小孩子挺喜欢的，具体还没有回家看，就评价了，到时再说
18	0.11, 0.88, 0.0	手感很好，尺寸合适，上身舒服，喜欢
35	0.0, 0.0, 1.0	非常好的保暖衣，很厚实，很热乎，非常好，这个买东西呀还是得看品牌，真的非
6	1.0, 0.0, 0.0	产品质量一般，号偏
11	1.0, 0.0, 0.0	运动服质量很好，穿上很舒服，棉质的透气吸
18	0.0, 1.0, 0.0	质量很差，布料也很差，建议大家选之前，多看看其他
11	1.0, 0.0, 0.0	有点薄，感觉是贴牌
14	0.02, 0.97, 0.0	才买一个月只穿一次就破洞，客服服务太多
14	0.35, 0.53, 0.1	尺码大小：正好实穿感受：舒服配送速度快，上午下单下午送达，很满
23	0.29, 0.38, 0.33	尺码大小：号码
11	1.0, 0.0, 0.0	你们包装真随便
11	1.0, 0.0, 0.0	很合身，小孩很喜欢，挺适合这段时间
