30	0.0, 0.0, 1.0	实穿感受：穿着很舒服，冰凉感觉一般尺码大小：尺码大小合适，非常合
29	0.0, 0.0, 1.0	失望，估计不会体验京东恒源
35	0.0, 0.0, 1.0	大品牌，用起来很放心，质量非常好，赶上活动购买非常的划算,客服真的很不错哦
35	0.0, 0.0, 1.0	不好，质量不好，还起球，真心
30	0.0, 0.0, 1.0	膝盖处颜色和图片有点差别，中厚
35	0.0, 0.0, 1.0	衣服透明，不适合我
35	0.0, 0.0, 1.0	内衣可以，布料柔软，内绒柔顺，厚溥适中，型号合身，非常满
35	0.0, 0.0, 1.0	老牌子穿着很舒服，搞活动比超市卖的合适。发货速度很
35	0.0, 0.0, 1.0	质量真差。穿了才两个多月全破了个口子一拉全裂
17	0.0, 0.64, 0.06	衣服很好，很透气，这两天气温飙升，还好它来了，真是很
26,30	0.0, 0.0, 1.0|0.0, 0.0, 1.0	涨价了，两天没看一单长了10块，质量
35	0.0, 0.0, 1.0	手感很好，穿的很舒服，就算出了汗，也不觉得难受，很好的运动
30	0.0, 0.0, 1.0	一般吧，没有想象中的好，毕竟价格就这摆着
35	0.0, 0.0, 1.0	质量不好穿2次皮筋
15	0.0, 0.76, 0.01	穿在身上弄的
24	0.0, 0.0, 1.0	材质很好，吸汗能力很强
35	0.0, 0.0, 1.0	衣服收到了，是纯棉的，质量很好，穿在身上效果不错，我儿子:米，斤我买了大号，穿上大小合适，搞活动，我一次买两
30	0.0, 0.0, 1.0	差评，还没出多长时间就起
35	0.0, 0.0, 1.0	***东西像屁股过一样太差
30	0.0, 0.0, 1.0	货已经收到，尺码大小刚刚合适，试穿了一下，很舒服。后续有什么好与不好的再来追加评
30,35	0.0, 0.0, 1.0|0.0, 0.0, 1.0	品质做工：做工精细，质量很好，款式时尚大气，很满意的一次购物
35	0.0, 0.0, 1.0	裤子穿着老是往上跑，有点怕
35	0.0, 0.0, 1.0	码数偏小有些严重，175-140斤xl只能说贴身，不是
35	0.0, 0.0, 1.0	实际货物与购买前不
35	0.0, 0.0, 1.0	这衣服布料跟抹布一样的要死商家非常的过分
35	0.0, 0.0, 1.0	衣服有弹力，跑步特方便，穿着凉快，特别喜欢
30	0.0, 0.0, 1.0	京东品质值得信赖，速度一如既往的快，十分好评！
24,26	0.0, 0.0, 1.0|0.0, 0.0, 1.0	的确纯棉，穿来睡觉很
35	0.0, 0.0, 1.0	这个衣服在穿着上还是挺好的，虽然是质感不是很好，但毕竟这个价格，你还要什么自行车能。以上是我对这件衣服的初始穿着体验
29	0.0, 0.0, 1.0	孩子非常喜欢，穿着很舒服，孩子朋友也很喜欢，下次还来
35	0.0, 0.0, 1.0	质量非常差很不满
23	0.28, 0.37, 0.35	懒哥说质量不错，
35	0.0, 0.0, 1.0	质量很好，推荐一
29	0.0, 0.0, 1.0	品牌知名度高，尺码大小也合适，做工细节非常好，锤子手感摸着舒服，穿着也舒服，保暖性能不错，厚薄程度适中，靠近性能良好，是一款性价比高的保暖
30	0.0, 0.0, 1.0	纯在身上扎扎的，不舒服
18	0.1, 0.81, 0.03	出于意料的好尺寸很合身物美价
24,29	0.0, 0.0, 1.0|0.0, 0.0, 1.0	尺寸大小合适，穿上后包裹性很好。吸汗性不错。送货还是一如既往的快
17	0.0, 0.63, 0.02	上身效果：非常好看很舒
11	1.0, 0.0, 0.0	说真的很一
25	0.0, 0.0, 1.0	很好的秋衣，一直买这个牌
30,35	0.0, 0.0, 1.0|0.0, 0.0, 1.0	裤子没包包感觉设计的一点也不方
26,32	0.0, 0.0, 1.0|0.0, 0.0, 1.0	质量一般，做工不细
26	0.0, 0.0, 1.0	衣服很好，大小合适，也很舒适
30	0.0, 0.0, 1.0	?收到立马打开看了一下，非常不错，质量超好，颜值又高?，推荐推荐
35	0.0, 0.0, 1.0	?宝贝收到了，很惊喜?，设计合理，时尚大方，继续关注，以后会回购的?
24,26	0.0, 0.0, 1.0|0.0, 0.0, 1.0	不是宽松大
35	0.0, 0.0, 1.0	差评，衣服没穿 先过水就已经变形，想着无聊疫情退换货麻烦，要求退点差价，几天没给我回复，一直说等回
17	0.0, 0.73, 0.21	薄款的 性价比
30,35	0.0, 0.0, 1.0|0.0, 0.0, 1.0	做工一般，穿着比较
24	0.0, 0.0, 1.0	穿着很舒服！吸汗性强
30	0.0, 0.0, 1.0	刚到货把所有衣服试了个遍穿上身很舒
26	0.0, 0.0, 1.0	恒源祥。老品牌了， 值得拥有！！ 质量有保证。。 做工挺好的， 面料舒服， 贴身 保暖效果很好！！ 京东的物流速度也是一如既往的给力！！ 多快好省- -給力京东
35	0.0, 0.0, 1.0	质量一般，有
35	0.0, 0.0, 1.0	没通知就放快递柜，为啥不送上门
26	0.0, 0.0, 1.0	没有说的那么
35	0.0, 0.0, 1.0	很好，穿上暖和，天冷就靠这保暖了。质量
35	0.0, 0.0, 1.0	**，就是一条秋裤，薄如一张纸，说好听的就是超薄的保暖
30	0.0, 0.0, 1.0	起球，真难受穿着，两天就非常宽松
29	0.0, 0.0, 1.0	一星不想给，买小了不给换货，太小了按她们的迟寸买的，试了一下不给换货，给她们发过去又拒收，来回折腾了，半个月，客服讲不清楚，在也不会买，。。
35	0.0, 0.0, 1.0	质量还行，穿着感觉还是挺舒服的。透气性不错，跑步的时候比较凉快。整体感觉还行吧。物流速度很快，当天就收到了。跑步还是得穿速干衣才行啊，要不然全身汗湿透了非常不舒服也懒得跑了，走穿速干衣感觉凉快多了也愿意多运动下了
30	0.0, 0.0, 1.0	厚薄程度：薄尺码大小：小物没有
24,35	0.0, 0.0, 1.0|0.0, 0.0, 1.0	尺码大小： 羊毛裤穿在下半身尺寸正好材质手感： 质感非常不错保暖效果： 羊毛裤在保暖方面，超穿在下半身很舒服，非常不
24	0.0, 0.0, 1.0	料子柔软有弹性，穿着很舒服，大小
24,26	0.0, 0.0, 1.0|0.0, 0.0, 1.0	宝贝收到了，是我喜欢的款式。恒源祥的内裤，果然是好～～～颜色很正，很喜欢。活动买的，价格实惠，送货速度快。一直在京东自营店买内衣，质量有保障，售后也很好。手感很舒服，柔软。是纯棉的，舒适透气。大小合适，码数标准。下次需要再
26	0.0, 0.0, 1.0	已收到快递就试穿了，，衣料很有弹性，穿上正好紧贴在身上很舒服，瘦身效果明显，加上李宁的，看起来还挺帅气，今晚就去夜跑体验
32,35	0.0, 0.0, 1.0|0.0, 0.0, 1.0	挺合适的，就是下错单了，该买加厚的保暖裤，不是加厚的秋裤，朋友们下单时一定要看清楚，一字之差，给你带来不必要的麻烦
30	0.0, 0.0, 1.0	太
30	0.0, 0.0, 1.0	做工细节：做工不错。材质手感：手感舒适。保暖效果：保暖效果
24,29	0.0, 0.0, 1.0|0.0, 0.0, 1.0	不错，穿起来没有静电，绒很软密。因为目前广东天气不算冷，所以暂时还无法体验其保暖性.厚度也偏厚那种不算特别
35	0.0, 0.0, 1.0	质量不
27	0.0, 0.0, 1.0	漂洗五次还有这么多纤维杂质，你是用什么做的
24	0.0, 0.0, 1.0	四个内裤 有个是
35	0.0, 0.0, 1.0	穿着很舒服，下次还会购买这样的衣服
30	0.0, 0.0, 1.0	以前买过穿着挺好，这次竟然面料和款式都变了，变得瘦长，没法穿送人了
26,15	0.0, 0.0, 1.0|0.0, 0.45, 0.3	质量一般般，底边有点发散，有点像喇
30	0.0, 0.0, 1.0	是南通一个厂买了恒源祥商标生产的，质量一般，细节不到位，毛头没弄
30	0.0, 0.0, 1.0	挺合身的。穿着也挺舒
30	0.0, 0.0, 1.0	面料很舒服，巴适得板，飞一般的感
35	0.0, 0.0, 1.0	最大号是闹着玩的吗，勒死
24,26,31	0.0, 0.0, 1.0|0.0, 0.0, 1.0|0.0, 0.0, 1.0	质量不好太差，手感不好，现在都不敢在网上买衣服了质量越来越差假商家太多
35	0.0, 0.0, 1.0	摸起来感觉很舒服，材质棉材
30	0.0, 0.0, 1.0	竟然起球，这么大个品牌，服?
24	0.0, 0.0, 1.0	东西非常好，穿着特别舒服，有弹性，真正的运动服，满
35	0.0, 0.0, 1.0	我真的非常喜欢它，非常支持它，质量非常好，和卖家描述的一模一样，我非常满意。我真的很喜欢它，它完全超出了预期的价值，交货速度非常快，包装非常仔细和紧凑，物流公司有一个良好的服务态度，交货速度非常快，我非常满意购
26,30	0.0, 0.0, 1.0|0.0, 0.0, 1.0	说的加绒加厚但是感觉就加绒了，厚应该是没加，跟秋裤差不多，没有保暖裤那种
26,30	0.0, 0.0, 1.0|0.0, 0.0, 1.0	给老公买的，一直买这个牌子的内衣，老公觉得不错，穿着很舒服，恒源祥内裤面料材质很舒服，抗菌面料手感绵软，很细腻的感觉，内衬带网透气效果好，小细节做的蛮好，下水洗了也不缩水，国产老牌子质量有保障，价廉物美
26,30	0.0, 0.0, 1.0|0.0, 0.0, 1.0	舒适程度：舒适吸汗效果：较好面料材质：不错，很合适
35	0.0, 0.0, 1.0	衣服大小还可以。质量不太好。衣服有异
24	0.0, 0.0, 1.0	快递已收到，要的就是大牌品质，尺码标准，版型很好，面料和店家描述的一致，上身效果很好，快递也是杠杠的
27,29	0.0, 0.0, 1.0|0.0, 0.0, 1.0	整体来说非常不错，效果可
30	0.0, 0.0, 1.0	宝贝和介绍的一样，质感很好，功能强大，用了感觉不错还
30	0.0, 0.0, 1.0	上身效果：收到了非常满意，很合
26	0.0, 0.0, 1.0	吸汗效果：非常好，吸汗透气，穿着很舒
26	0.0, 0.0, 1.0	垃圾，李宁，搞得像是穿过的一样，褶皱的不
24,27	0.0, 0.0, 1.0|0.0, 0.0, 1.0	只穿了一天裤子，就一个洞，质量太
35	0.0, 0.0, 1.0	会夹到缝里的，不怎么好，有点线头，布碎，其他
24	0.0, 0.0, 1.0	穿着不舒服 穿档
29	0.0, 0.0, 1.0	就一个灰的，其他我看都一个颜色，
35	0.0, 0.0, 1.0	布料十分的舒服，做工有可以
24	0.0, 0.0, 1.0	一点都不保暖，不要买，兄
27	0.0, 0.0, 1.0	第二次购买了，穿起来感觉没有第一次的舒服，总感觉材质有些硬，颜色也偏暗。总体评价是
35	0.0, 0.0, 1.0	这次喜欢！非常好，穿着很舒服！是大牌！是正品，确认过眼神！就是我喜欢的理由！李宁！一切皆有可能！非常喜欢很满意，穿着很舒服！京东，这个平台非常好！买了很多的东西，都是非常满意的！这次活动，力度非常大，很满意，很好
26	0.0, 0.0, 1.0	买来就有点后悔了，到现在标还没
24	0.0, 0.0, 1.0	尺码大小：尺码大小正合适，本人182，穿上正好做工细节：做工细节也不错吧，没有乱七八糟的线材质手感：材质手感很不错保暖效果：保暖效果也很
24	0.0, 0.0, 1.0	一口气买了两套 一深一浅 很好 手感不错 质量上乘 老妈说比一般的厚一些 但比最后的还要薄一些 哈哈 总之 满意 满意 会再
23	0.27, 0.4, 0.33	李宁恤质量非常好，大品牌值得信赖，买过好多件儿的。支持京东，京东购物非常方便，服务好。会员返的金豆还多。京豆还可以当钱花，非常实用
23	0.26, 0.39, 0.36	衣服不干净有黑点，洗不
29,35	0.0, 0.0, 1.0|0.0, 0.0, 1.0	裤子没有口袋，钥匙都没地方放，休闲运动时不方便！！
30	0.0, 0.0, 1.0	不错，是纯棉的，可
24	0.0, 0.0, 1.0	可以，送货速度很快，服务很好，质量不知道怎么样，还没有穿
35	0.0, 0.0, 1.0	快递小哥配送服务积极，按时送达，合身，图与实物一样但是包裹破损了，虽然快递小哥尽力了，但是包裹破损了下次希望主要
35	0.0, 0.0, 1.0	裤子保暖厚实，穿着暖和
31	0.0, 0.0, 1.0	穿着很舒服，很轻便。就是肚子太大，穿着不帅气
23	0.25, 0.38, 0.36	京东的速度真是惊人，晚上买的，第二天一早快递就给送到家门口了，太赞了，保暖的质量
35	0.0, 0.0, 1.0	尺码显示一样，但是穿着时有大
27,29	0.0, 0.0, 1.0|0.0, 0.0, 1.0	没
35	0.0, 0.0, 1.0	好像好像好的好的
24	0.0, 0.0, 1.0	真差，上衣做工差得不敢穿，懒得退货，当垃圾处
26	0.0, 0.0, 1.0	毫无异味，包装也比较精细质量行，客服细心完全出期望值。卖家发货速度非常
26,30	0.0, 0.0, 1.0|0.0, 0.0, 1.0	一般般有线头，色上的也不均匀，缝合粗糙。不知道洗了掉不掉色，缩率
24	0.0, 0.0, 1.0	不错，穿得很舒服可以
26,30	0.0, 0.0, 1.0|0.0, 0.0, 1.0	很实惠，感觉很好，非常完美.^?^
35	0.0, 0.0, 1.0	质量太薄了，还是没有以前的好，说是加绒加厚全是
30	0.0, 0.0, 1.0	面料材质：差，洗一次就烂
24,35	0.0, 0.0, 1.0|0.0, 0.0, 1.0	宝贝收到啦，质量特别好！支持京
35	0.0, 0.0, 1.0	很薄，性价比不高，不值得，质量
35	0.0, 0.0, 1.0	物流很快，大品牌值得信赖，保暖效果好，尺码正好穿上
24	0.0, 0.0, 1.0	宝贝收到了，包装很好，宝贝和店家描述的一样，货真价实，性价比高，总体来说，是一次满意的购物
24	0.0, 0.0, 1.0	有一条是这样的，
24	0.0, 0.0, 1.0	两条裤腿不一样长，退换货还不保证时效，真的无语了，尺码大小：裤腿不一样长做工细节：尺寸不
35	0.0, 0.0, 1.0	很好，薄而透气，紧身，穿着很显身材。很满意的购物，信任京东
24	0.0, 0.0, 1.0	穿着非常舒服，紧贴身，运动效果非常好，已经推荐给好友再买了一
30	0.0, 0.0, 1.0	买的时候问了尺码了，到了又小了，问客服也是爱理不理的
24	0.0, 0.0, 1.0	太薄了，就单层的，
26	0.0, 0.0, 1.0	第一次买运动服，面料不错试穿了一下很舒服！有了装备不知道坚持
30	0.0, 0.0, 1.0	质量保证、价格实惠、一点点掉色，已经很满意了！支持一下！
30,32	0.0, 0.0, 1.0|0.0, 0.0, 1.0	舒适，温暖，亲肤，
26,30,35	0.0, 0.0, 1.0|0.0, 0.0, 1.0|0.0, 0.0, 1.0	这个产品和它价位相比来说，还是很合适的产品质量，客服服务态度特别好，很喜欢，好评超出预期，质量很好，做工精细，
29	0.0, 0.0, 1.0	衣服收到，非常满意。客服态度很好，非常贴心，会再次选择他家
24	0.0, 0.0, 1.0	最完美一次网上买衣服，下午拿到快递晚上回来洗一下还不到一个小时干，非常满意的一次网购
30	0.0, 0.0, 1.0	一分价钱一
35	0.0, 0.0, 1.0	面料很好，物流快，给好
35	0.0, 0.0, 1.0	恒源祥天然艾草植物抗菌内裤，艾维抗菌纤维是将纤维分子与天然艾草因子相结合，制成的一种具有纯天然艾草成分的抗菌纤维：天然性，高抗菌，功效
26	0.0, 0.0, 1.0	.尺寸不是很准，本人身高，体重公斤！穿衣服有点偏小，但是短裤超大哦！很不协调！.材质方面只能说很凑合，不是很舒服，月底穿还有点热的！运动后的效果一般吧！.购买后的亲，一定要先洗个遍再穿，一个是有味道，另一个就是掉杂色！.李宁的速干系列估计和一般的品牌没区别了！想要更舒适的朋友，建议还是购买耐克系列吧！真心要比李宁强太多
25	0.0, 0.0, 1.0	羊毛裤的质量非常好，面料穿着非常舒服，尺码准确，做工精细，喜欢的可以订
24,29	0.0, 0.0, 1.0|0.0, 0.0, 1.0	尺码大小：非常合身实穿感受：轻薄透气，穿着舒适，这次购买的商品，没想到效果这么
24	0.0, 0.0, 1.0	保暖裤的穿着体验上，由于类似莫代尔的柔软性，因此穿着过程有种打底裤材质的亲肤感，比较紧翻，不过透气性上比厚款的保暖裤还是透气的多，前后档部倒比较舒适，不会对三角区有桥压感。裤腿部分较为系鄉，活动关节处活动也会有那么点紧绷感，也许是我的腿粗问题？这款保暖裤穿起来同样可以透肉看到腿部皮肤，因此穿着时候腿部全程冷
30	0.0, 0.0, 1.0	衣服已经收到了，质量很好，尺寸也刚刚好，非常满意的一次购
29	0.0, 0.0, 1.0	感觉穿起来非常舒服，也很有弹性，穿之前洗过一次，没有发现掉色得情况。款式也很好看，比较修身，在家里穿着也比较舒
12	0.01, 0.98, 0.01	购买同一个码数，裤长差太
24,29	0.0, 0.0, 1.0|0.0, 0.0, 1.0	真是垃圾中的极品，一次性的东
27	0.0, 0.0, 1.0	做工精细呢，厚薄适中，穿着舒服，颜色很正吁，款式好
26	0.0, 0.0, 1.0	很厚实，手感也是特别柔软的，穿上相当随体，不
24	0.0, 0.0, 1.0	产品收到了，试穿了一下大小合适，质量很好，秒杀的，很
30	0.0, 0.0, 1.0	质量差得很，穿起一点都不
26,27,29,35	0.0, 0.0, 1.0|0.0, 0.0, 1.0|0.0, 0.0, 1.0|0.0, 0.0, 1.0	款式和板型都非常好，不会变形恨时尚洋气。无刺激，味道。也很，好看。料子摸着还很舒
24	0.0, 0.0, 1.0	物流很快，商品符合要
35	0.0, 0.0, 1.0	尺码大小：大小很合适做工细节：精细、无线头材质手感：手感柔软舒服保暖效果：非常
24	0.0, 0.0, 1.0	就这样还想要好评？客服询问原因，只说留言不给，问题解决，我直接果断退
30	0.0, 0.0, 1.0	性价比很好衣服质量不
24,27,29	0.0, 0.0, 1.0|0.0, 0.0, 1.0|0.0, 0.0, 1.0	还没有我的秋裤厚，那里来的加绒加
35	0.0, 0.0, 1.0	一般，没有太多弹力，我穿着不是很
24	0.0, 0.0, 1.0	一般不厚，感觉挺薄
35	0.0, 0.0, 1.0	裤腰还行算是宽松，裤腿有点短啊，穿着脚脖子顾不到有待
24,27	0.0, 0.0, 1.0|0.0, 0.0, 1.0	开始跑步后就置办了一身李宁的运动装，穿上真的很贴身，我买的是加绒款，冬天穿着跑步也不冷，还有运动款的内衣，真的是超赞，推荐给大家
24	0.0, 0.0, 1.0	第二次
29	0.0, 0.0, 1.0	买了两套一样大的，一套袖长点，一套短，啥质量这是？好评都是刷出来的吗，牌子摘了，算了凑合
24	0.0, 0.0, 1.0	感觉比较薄，然后号码比一般的要小一号，建议买大一
30	0.0, 0.0, 1.0	大品牌就是值得信赖，感觉还是非常不错的。做工细节：恒源祥的纯棉面料非常舒适透气，感觉很好。保暖效果：秋季初冬很适
24	0.0, 0.0, 1.0	纯棉的，质量很好，非常满
29	0.0, 0.0, 1.0	我只能说太垃圾，标签你襄那里的！材质也不行，感觉就值2毛
26	0.0, 0.0, 1.0	布料太差了，根本就不是纯棉的，袖子短，正身长，垃圾，都不要
27,29	0.0, 0.0, 1.0|0.0, 0.0, 1.0	收到了，看到实物很满意。面料、做工、手感还
35	0.0, 0.0, 1.0	套装质量很好，做工精细，上身很好看，
35	0.0, 0.0, 1.0	一般  
35	0.0, 0.0, 1.0	秋衣秋裤穿着舒服，做工还是挺好的，质量杠杠
30	0.0, 0.0, 1.0	手洗了几遍，水里还是掉了很多毛绒绒的细毛和一些其他碎屑，质量忒
24	0.0, 0.0, 1.0	，。合身，想要宽松的可以拍大一
30	0.0, 0.0, 1.0	质量很赞的秋衣裤套装，面料柔软亲肤有弹性，保暖吸汗，款式简单大方，这个价格捡漏了
30	0.0, 0.0, 1.0	五件套，价格划算，而且质量很好，买的挺值的，好评好评好评好评好评好评好
30	0.0, 0.0, 1.0	尺码大小：实穿感受：非常合身，大品牌有保证，做工也好，就等天气暖一点户外锻炼穿
29	0.0, 0.0, 1.0	一般，没有想象中
35	0.0, 0.0, 1.0	质量太差，还是一分价钱一分货呀！不能贪图
27,29	0.0, 0.0, 1.0|0.0, 0.0, 1.0	还不错，老公很喜欢，料子很舒服，凉
26,32	0.0, 0.0, 1.0|0.0, 0.0, 1.0	上身效果很好，面料很适合运动，跑步很合适，轻薄透气，很合适
30	0.0, 0.0, 1.0	衣服挺好的，挺厚实，穿着也不错，面料也非常好，昨天洗之前先泡了泡，也没有出现掉色的情况，也没有缩水，很
26	0.0, 0.0, 1.0	实穿感受：衣服很好，质量特别棒，肯定是正品，而且快递很快一天就送到了！怪不得回头客这么
29	0.0, 0.0, 1.0	昨晚收到，今天第一次穿去打篮球。在光滑的地板上摔了一次，就破成这样。质量堪
24	0.0, 0.0, 1.0	
30	0.0, 0.0, 1.0	没有描述哪
26	0.0, 0.0, 1.0	褪色！直接无语，下次不来
24,26,27	0.0, 0.0, 1.0|0.0, 0.0, 1.0|0.0, 0.0, 1.0	该用户觉得商品
26	0.0, 0.0, 1.0	买过好几次了，由于身高体重，尺码够大，质量也不错，价格也非常的便宜，正好还赶上活动，推荐大家购买，有想买的赶紧下手，机不可失，失不再
35	0.0, 0.0, 1.0	衣服很舒服，穿着也好看，厘米斤，穿正好，标志用洗衣机洗的也没掉，不
26	0.0, 0.0, 1.0	性价比非常高?，可以放心购买?，做工非常精致?，值得购买?
35	0.0, 0.0, 1.0	本人屁股大，买了这个尺寸穿着挺舒
29	0.0, 0.0, 1.0	这件李宁是假货的差
30	0.0, 0.0, 1.0	很快就收到了，试了一下质地柔软舒适，然后下水洗了没有掉颜色，很快就干了
27	0.0, 0.0, 1.0	质量很好，性价比较高，是一次愉快的
27	0.0, 0.0, 1.0	我拍的是号，发给我的是号，让我说什么好？问客服，客服在线也不回话
35	0.0, 0.0, 1.0	穿着也不是特别舒服，整体感觉
30	0.0, 0.0, 1.0	棉裤老薄了，东北的慎重
24	0.0, 0.0, 1.0	试穿一下不合身，寄回去说没吊牌，不给换，我就试穿了下什么都没动，说不能换，是不是喜欢玩欺骗消费者
26	0.0, 0.0, 1.0	挺好，暖暖和和过冬天了&hellip;&helli
30	0.0, 0.0, 1.0	孩子很喜欢刚，穿上运动很舒适
24	0.0, 0.0, 1.0	看起来衣服真的是的不行，千万别买，真是人的东
24	0.0, 0.0, 1.0	没得说，客服推荐的尺码穿着嘞，不
24	0.0, 0.0, 1.0	质量特别差！穿了一次就掉色了，太阳一晒掉色明显。我买个衣服只能在晚上穿呗？
29	0.0, 0.0, 1.0	一般一般，一分钱一分
35	0.0, 0.0, 1.0	很好，非常好，穿着很舒服，就是尺码小了一丢丢，可能最近发胖了了
26	0.0, 0.0, 1.0	号码严重不标准，而且商家特别#，花钱买教训，再也不来了，祝商家早日关门
26	0.0, 0.0, 1.0	非常舒服的短裤，穿上去自信了很多。颜色有我也非常喜欢，洗的时候也不伤手，加上洗衣液的加持，可以洗得特别的干净，反正非常满意的一次购物体
24	0.0, 0.0, 1.0	穿着很舒适，也很合身，推荐购
30	0.0, 0.0, 1.0	不错的一套衣服，很舒服今天老公陪着出门，天气很热，但衣服透气很好，干的也快，不然出了汗身上很难受，这衣服值得
35	0.0, 0.0, 1.0	好看精神面料材质柔软舒适上身效果好舒适透气潮流吸汗透气效果好纯棉面料材质柔软舒适透气颜色搭配非常好看大小合
26,29	0.0, 0.0, 1.0|0.0, 0.0, 1.0	纯棉质感，亲肤舒适，尺码适中。一次入手两套，一套送老爸，一套送老公，试穿了都说很舒服很满意。快递超级给力，昨天下单，今天到货，必须赞一
30,35	0.0, 0.0, 1.0|0.0, 0.0, 1.0	这还加绒加厚呢，还没保暖
29	0.0, 0.0, 1.0	尺码标准，面料柔软，做工不错。好的商品放心购
30	0.0, 0.0, 1.0	衣服短，动一动就往上爬，难
30	0.0, 0.0, 1.0	这是保暖内衣吗？太薄了，后悔了。不如秋衣秋裤
30	0.0, 0.0, 1.0	货收到了，不错哦，质量很好，发货速度很快，是全棉的，下次还来光顾，过5颗星星
23	0.23, 0.4, 0.36	不
30	0.0, 0.0, 1.0	尺码大小：码比较正实穿感受：买给弟弟的，小孩说试穿了一下很有型，面料是舒服很吸汗的那种，推荐推
35	0.0, 0.0, 1.0	这款短袖还不错，面料很好，材质很不错。穿着很舒服，吸汗效果很不
35	0.0, 0.0, 1.0	我刚买完你们就降价，什么意
30,35	0.0, 0.0, 1.0|0.0, 0.0, 1.0	衣衣质量不错，老公穿着很合适，速干的面料正适合爱出汗的他，超
26,27,29	0.0, 0.0, 1.0|0.0, 0.0, 1.0|0.0, 0.0, 1.0	质量真不咋滴，洗了一次还是两次忘了，紧身裤腿直接开线两边都开线附上图片大家看看;
29	0.0, 0.0, 1.0	春节后倒春寒，赶紧给老爸买两套作替换，洗过后也没有明显缩水。价格也不错。尺码大小：XL做工细节：全棉的厚薄程度：适合春
26,30	0.0, 0.0, 1.0|0.0, 0.0, 1.0	纯棉的材质，感觉很
29	0.0, 0.0, 1.0	衣服面料，穿起来还可以，但是秋衣圆领领口太大，太大。。
24,30	0.0, 0.0, 1.0|0.0, 0.0, 1.0	太薄了，不值这个价
24	0.0, 0.0, 1.0	比较差的一次体验，虽然钱不多，但体验感太差：.我买的图片大标红色的，结果发的是小标灰色的.其他短袖恤我都是选，没有一家大小有问题，唯独这家小的不是一点点.退换货时因为有件我拆标了，也问了客服，客服说寄回去就行，结果告诉我标签有件没有，两件需要都返回，沟通后发现他们沟通问题很大，态度也很一般，反正也就几十块，也无所谓了，不过体验太
26,35	0.0, 0.0, 1.0|0.0, 0.0, 1.0	买长了，小个码就好了，又懒得退，将就穿了
29	0.0, 0.0, 1.0	本来是要好评的，没有裤兜太不方
26	0.0, 0.0, 1.0	
35	0.0, 0.0, 1.0	质量一
29	0.0, 0.0, 1.0	超不舒服，又热又
24	0.0, 0.0, 1.0	也就那样吧，不是我想要的
24,26	0.0, 0.0, 1.0|0.0, 0.0, 1.0	一般般，或者说和广告看到的不符。感觉不
35	0.0, 0.0, 1.0	恒源祥老品牌果然值得信赖。做工精细，细节处理的很好，没有多余的线头。这个价格买到这样的质量值了。有需要的话还会回购
30	0.0, 0.0, 1.0	上身效果：很好面料材质：舒服吸汗效果：不错下次还会光顾本店
30	0.0, 0.0, 1.0	多次购买的商品，很好，款式，面料，清洗等方面都不错
24	0.0, 0.0, 1.0	东西收到了，物流速度很快，质量不错，很喜欢，推荐大家购买！好
35	0.0, 0.0, 1.0	恒源祥的秋衣套装干净漂亮，做工很不错，没发现什么瑕疵，个人感觉大小也挺合适，找了很久选的这款，大
35	0.0, 0.0, 1.0	果然是大品牌，值得信任压，尺码合适，做工优越，材质柔软，穿着舒适，保暖效果一级棒！
