35	0.0, 0.0, 1.0	卖家的服务态度真好，发货很快。商品质量也相当不错。太喜欢了，谢谢
4	1.0, 0.0, 0.0	没内裤的质量不错，摸着很厚实，洗了好几次了，没有起球，也没有缩水变形，四角的穿着也很舒服，物流也挺快的，很满意的一次网
11	1.0, 0.0, 0.0	有点薄，没有想象的那么
11	1.0, 0.0, 0.0	感觉不贴身，保暖效果不明显。可能在家里穿好点。如果是户外活动，尤其是骑车穿，还是慎
6	1.0, 0.0, 0.0	服饰材质很棒，穿着很舒服，快递也很快，服务态度特别好，下次还到这买衣服，特别喜
4	1.0, 0.0, 0.0	一般般，没有想象的那么好，总体来说还不错。就是有点贵，也不知道可以用多久。总之来说一般般吧，想买的可以试试，但是不好不要怪我哦。个人觉得一般般吧
3	1.0, 0.0, 0.0	不知道从什么时候开始，京东物流居然不送货上门。直接放自提柜，叫去拿。真的越做越烂！迟早倒
18	0.32, 0.67, 0.01	内裤穿好多天了，才来评价哈，质量非常好，老公很喜欢，价格很美丽，比实体店便宜很多哦，但质量绝对可以的哦，纯棉的，尺码也标准，想买的亲，可以直接下单
8	1.0, 0.0, 0.0	就这个包装，先给个差
3	1.0, 0.0, 0.0	尺码大小：尺码要结合自己的身高体重做工细节：做工很不错，膝盖这一块都格外的设计的好，舒服又软，感觉运动啥的很舒适材质手感：手感细腻柔软丝滑保暖效果：保暖效果一流厚薄程度：厚度刚刚好，穿搭百变，方便配衣服裤子透气效果：透气效果也很
3	1.0, 0.0, 0.0	衣服收到，质量不错，穿着舒服又
11	1.0, 0.0, 0.0	质量可以、面料摸上去感觉很好、大小刚合
6	1.0, 0.0, 0.0	面料不错，摸着手感很好，试穿了一下很舒适，线口什么的也处理的很好，已经洗了，过几天再来追
11	1.0, 0.0, 0.0	给老爸用的，超级喜欢，质量很好！不错不
0	1.0, 0.0, 0.0	起球，就是垃圾，刚买的四十块钱的都比
26,32,35	0.0, 0.0, 1.0|0.0, 0.0, 1.0|0.0, 0.0, 1.0	很不错，整体都很满意，一直很喜欢自营，对自营的东西很放心，收到货之后也是正品，盒子包装挺完美的，里面标签防伪的都有，嗯，穿着舒服，上身大小尺码都很合适，刚收到货，可能会有一点紧嗯，但是洗过两三次之后，穿过之后就比较正常宽松了，有浪莎的logo挺喜欢的，很明显，内衣还是选择浪莎比较放心，后续都会在这里购买，也会推荐给家人购买这个品牌
18	0.02, 0.96, 0.02	质量很好，做工精细，码数标准，穿着很舒服，很喜
24	0.0, 0.0, 1.0	面料材质：全棉面料，手感很不错。上身效果：衣型很好，不松不紧正合适。舒适程度：全棉材质穿着很舒服。吸汗效果：吸汗效果应该不错，应该与速干衣不一样。身材体型：正常体型。其他特色：李宁大品牌，品质有保障
18	0.0, 0.99, 0.0	温暖舒适，陪伴了我一整个冬天。如果能够弹性再好一点，就完美了！物流给力，活动也是很优惠
17	0.01, 0.99, 0.0	特别埋汰，物流特别慢
14,18	0.0, 0.46, 0.16|0.0, 0.85, 0.01	很薄很薄，估计穿不了几次啊？不算
12	0.0, 0.73, 0.27	衣服收到，质量不错。手感不错。非常舒服，支持国
23	0.24, 0.51, 0.24	同一个尺码，每条大小松紧居然不
18	0.01, 0.98, 0.0	尺码大小：刚好衣服质量不错售后服务很
24	0.0, 0.0, 1.0	这个质量不敢恭维，还没有地摊货好
12	0.0, 0.94, 0.0	已收到货  有一条是烂的 爆
3	1.0, 0.0, 0.0	客服很专业，谢谢了，历史以来网购很可以的一次，这个价格买到真的想不到物流也飞快，东西
24	0.0, 0.0, 1.0	快递还是挺快的，这真的就是一条棉裤啊，很厚，膝盖上还有加厚，很贴心，也很贴身，工勤的时候穿很暖和，脚口的收口设计也很赞，寒冷的冬天有它就
24	0.0, 0.0, 1.0	是理想中的产品，质量不错，物流也很快，值得点赞每一次都很满意，这次选的宝贝更加满意，以后还会一如既往地买
6	1.0, 0.0, 0.0	质量一般般般般般般般般
23	0.27, 0.39, 0.33	这个衣服我建议买大号的。我买的穿几次稍微有点变形
15	0.01, 0.96, 0.03	还没穿，不过手感还行，这牌子也是老牌子了，值得信赖，价格还便宜，超市都没这
12	0.17, 0.82, 0.0	设计贴心，大小合适，简约简
27	0.0, 0.0, 1.0	还不错，儿子说穿上运动很舒服，比纯棉的适合运动，好
12	0.16, 0.83, 0.0	料子很舒服，价格总是变，没有太多优惠，客服服
14,6	0.01, 0.76, 0.01|1.0, 0.0, 0.0	穿上才发现，开线了，质量有点
18	0.01, 0.99, 0.0	太薄了，气温低了不
11	1.0, 0.0, 0.0	性价比高，我很喜欢，下次还会光临宝贝收到，一如既往的好，包装很到位，质量还不错，很喜欢，大品牌值得信赖第一次在网上购买，也是看评价才买的，质量还不错，也很便宜，有需要的朋友可放心
3	1.0, 0.0, 0.0	穿一次整套衣服就起球了，不
14	0.02, 0.97, 0.0	恒源祥的内衣内裤总体来说良莠不齐，有很多套牌生产。不过秋衣秋裤品质尚可，可能是由于不是冬天穿的也不需要厚度保证。物超所值，商品设计完美，外观也很高大上，让人爱不释手。客服更是热情的没话说，这次购物很
18	0.03, 0.93, 0.04	衣服非常轻，非常透气，穿起来也非常舒服，柔软舒适
11	1.0, 0.0, 0.0	面料舒服，穿起来不
26	0.0, 0.0, 1.0	尺码挺合身，面料舒适，穿起来很好看，运动穿也行，平时穿也行。下次还会再来
23	0.22, 0.57, 0.22	商品和实物相差严重，质量非常差，根本就不是李宁，别上当了。客服为了不让差评说补偿元。套
12	0.01, 0.99, 0.0	挺好的，价格适中，质量看着不错宝贝已收到?，超级喜欢，颜值高又实用，超级喜欢！?
23	0.25, 0.47, 0.29	试穿了很喜欢，很薄，很舒服，不过没有更大的号码很遗憾
14	0.34, 0.66, 0.0	衣服不错，上身效果也很好，吸汗效果具
4	1.0, 0.0, 0.0	发货速度很快衣服摸着舒服主要是这个价格和一百多衣服质量差不
17	0.04, 0.53, 0.03	很实惠的购物，买了套，老婆和我各一套、五件
11	1.0, 0.0, 0.0	是正品，儿子非常喜欢，速干的穿着柔软，清爽，客服也非常有耐心去给介绍，衣服的质量，多身高体重多少穿多大码的。一次非常不错的购物，还会在来了
18	0.05, 0.89, 0.04	衣服确实不错，面料很舒服，有弹力，透气性好，穿着很舒适
18	0.03, 0.73, 0.0	一般，不值这个价，不想退货就
12	0.01, 0.76, 0.0	还可
18	0.01, 0.94, 0.0	设计很精细，面料很舒服，摸起来手感很好。我挺喜欢的
14	0.01, 0.85, 0.0	腰太大，像旧的，买了两天降
12	0.06, 0.89, 0.04	第一次网购内裤，恒源祥品牌以前买过衬衫，这款内裤质量很好，适合春天、秋天、冬天穿，很暖和、比较舒适。夏天穿有点闷热，不建议买了夏天穿。唯一不好的就是网页上介绍各种材料的比例与内裤上呢标贴材料比例不一
23	0.23, 0.51, 0.26	我能说这个是假的不，第一次穿这种所谓的速干衣，跑了之后，有汗的衣服是贴在身上
35	0.0, 0.0, 1.0	买了大一码，结果还小了，不建议购买，洗了也不能换，
11	1.0, 0.0, 0.0	蛮厚实的，颜色正穿着暖和，面料舒适，大小也合
12	0.0, 1.0, 0.0	质量一般没有效果
6	1.0, 0.0, 0.0	尺码大小：真的很好用，对商品非常满意，属于无限回购款，推荐！实穿感受：宝贝特别喜欢，颜值高质量好，中看又中用，有需要的朋友不要犹豫了，最后祝商家生意兴隆
6	1.0, 0.0, 0.0	衣服收到后就上身试了一下，很贴合，挺舒服，穿着身上很舒适一点都不拘束.款式设计挺满意的，颜色款式比较百搭，做工上也是精细没什么线头，洗的时候也不会掉色起毛起球，有弹性样式简单大方，很
2	1.0, 0.0, 0.0	隔天就到了，质量不错，码数标准，家里人一直穿的都是这个牌子。这个牌子的质量很放
3	1.0, 0.0, 0.0	没想到缩水非常严
12	0.01, 0.99, 0.0	比我之前在沃尔玛超市79元一套的质量差太多，轻薄、尺码较小，&ldquo;京东自营&rdquo;也不能信，很差的一次购物体验，**！&hellip;&helli
0	1.0, 0.0, 0.0	换货时物流时间长，换的货都开口，一看就是不整齐，少中间隔纸
12	0.07, 0.93, 0.0	不是
18	0.28, 0.63, 0.01	拿到手里面的第一感觉
12	0.43, 0.53, 0.03	描述一样，非常满意，穿上很舒
18	0.01, 0.99, 0.0	说的不符 加绒款  纯纯骗
3	1.0, 0.0, 0.0	还不如我一个秋裤厚，这个价格性价比太次了，一点都不
3,6	1.0, 0.0, 0.0|1.0, 0.0, 0.0	面料材质：面料材质还可以就是有点薄上身效果：老师效果挺合身的，适合。夏天。舒适程度：挺舒服的，穿上以后。吸汗效果：吸汗效果特别好。身材体型：我身材比较胖，穿上以后呢，挺显瘦的。其他特色：穿上以后呢，特别凉快，特别舒服。嗯，适合夏天。嗯，运动跑步穿。京东商城的物流还是很快的，值得信赖。销费体验特别好
35	0.0, 0.0, 1.0	一直相信恒源祥的品质，这是第二次购买恒源祥的保暖内衣啦(??&omega;??)??尺码大小很合适，袖口领口等细节也处理的很好??(ˊ&omega;ˋ*)??衣服摸着手感不错，穿在身上很舒服！但自我感觉，没有想象中的厚
11	1.0, 0.0, 0.0	穿在身上很舒服，冰凉冰凉
35	0.0, 0.0, 1.0	洗了一次就掉色，真坑
12	0.04, 0.67, 0.08	面料穿着还是挺舒服的，颜色也合适，只是感觉弹性差了点，跟以前买一样的号穿着稍有点紧，不过也能穿，总体来说这个价格还是可以
18	0.0, 0.57, 0.0	很不错，质量很好，弹性不错，穿起来也特别有型，洗过以后评论的，可以放心不掉色
18	0.01, 0.99, 0.0	老公身材有点胖，穿这个也很舒适，
6	1.0, 0.0, 0.0	尺码偏小，号码不准，已经送
18	0.01, 0.67, 0.0	宝贝收到了，质量一
15	0.0, 0.98, 0.0	是正品，面料摸着舒服，做工细致，款式和图片一样，穿上效果特别好，比实体店便宜的多，有需要还会再
6	1.0, 0.0, 0.0	发货速度快，衣服面料好，质量优良，价廉物美，值得信赖，值得购买
0	1.0, 0.0, 0.0	不
23	0.32, 0.34, 0.34	收到了唉，外观颜值非常高，码数大小合适，面料质感柔软，穿着非常的舒适呢，很百搭
18	0.05, 0.92, 0.02	快递员不打电话也不发短信直接放快递驿站，小区那么多个快递驿站让我到哪
35	0.0, 0.0, 1.0	比垃圾还垃圾，谁买谁上当千万不要
23	0.29, 0.4, 0.31	这款秋衣棉质非常紧实，适合刚入秋，天气骤冷时穿着。是正品，版型比较贴身，不臃肿。而且纯棉吸
12	0.0, 0.96, 0.03	保暖衣质感摸着柔软很舒服，和店家描述的一样，是纯棉，很合身，下次再
18	0.0, 0.95, 0.0	做工很精细，细节处理也很到位的，款式很大方咳，手感特别
23	0.25, 0.47, 0.28	快递服务好，衣服质量挺好的，跟图片一样，穿上也合身，价格也亲民！非常满意
18	0.43, 0.51, 0.02	反过来洗了2次才没有掉毛
12,14	0.01, 0.53, 0.01|0.0, 0.84, 0.0	尺码大小：尺码标准，非常合适。 做工细节：做工精良精细，和之前买的一
35	0.0, 0.0, 1.0	色差太大了和图片不
23	0.28, 0.43, 0.29	质量不错，面料摸起来非常的细腻 在膝盖的位置，增加了两块护膝，更加保暖做到了 膝盖弯曲的时候，一点不会紧绷，
0	1.0, 0.0, 0.0	正品，性价比高，大品牌值得信赖，买的放心，价钱也公道，满意！很显高档，洗后衣服不悼色！值得拥有
12	0.0, 0.98, 0.01	质量超好的，布料是棉的，里面的绒很厚实柔软，穿着很舒服暖和，店家推荐的码数也
11	1.0, 0.0, 0.0	加绒裤收到了，质量很好，面料柔软舒适，颜色正，上身效果好，很满
23	0.22, 0.55, 0.22	感受不好穿
18	0.1, 0.6, 0.0	做工精细，质量很不错，每年都会买这个牌子的，好穿，毛绒细腻，暖宝又
6	1.0, 0.0, 0.0	秋衣纯棉面料，穿上柔软很舒服，尺码标准，颜色与图片相符，质量性价比蛮高的，还打算买一件换着穿，值
18	0.02, 0.88, 0.1	布的，一点弹性没有，糟
6	1.0, 0.0, 0.0	冬天很适合，避免皮肤直接裸露在空气中，防止寒冷的天气
3	1.0, 0.0, 0.0	宝贝已收到，包装完好无损，质量很好，值得信
15	0.0, 0.89, 0.0	穿着很帅气，价格实惠，下次介绍朋友
23	0.26, 0.41, 0.33	东西真的很薄，舒适度一般吧，还没穿，穿了再来追评，感觉不像正
0	1.0, 0.0, 0.0	售价一百多的居然是歪货，不得不吐槽！穿上身透热性很差，洗好了晾干还会有布料味，根本就不是速干衣！李宁会出这么差的运动服？？骗谁。。。真的是无语！
35	0.0, 0.0, 1.0	太无语了，快递没收到，都显示签收了，还让自己联系快递，态度
18	0.2, 0.68, 0.02	严重掉色！穿第二次洗还掉色！并不是速干面料！新衣服有股很大的味
35	0.0, 0.0, 1.0	实穿感受：挺舒服，跑步穿很贴身，吸汗超轻
11	1.0, 0.0, 0.0	布料没弹性，线头外露，最不好的是铭牌很刺皮肤，非常不舒服，不建
17	0.04, 0.91, 0.05	很好穿，尺码也很合适，穿着很保暖，质量也
12	0.0, 0.99, 0.0	掉毛掉毛掉毛掉毛掉毛掉毛掉毛掉毛掉毛掉毛掉毛掉毛掉毛掉毛掉毛掉毛掉毛掉毛掉毛掉毛掉毛掉毛掉毛掉毛掉毛掉毛掉毛掉毛掉毛掉毛掉毛掉毛掉毛掉毛掉毛掉毛掉毛掉毛掉毛掉毛掉毛掉毛掉毛掉毛掉毛掉毛掉毛掉毛掉毛掉毛掉毛掉毛掉毛掉毛掉毛掉毛掉毛掉毛
12	0.01, 0.98, 0.0	送货速度快，很凉爽，舒服。质量不错，值得拥有
0	1.0, 0.0, 0.0	图片和实物不一
0	1.0, 0.0, 0.0	和描述的有误差，太薄了，这价格
6	1.0, 0.0, 0.0	很好看，衣服也很厚实，这个季节穿刚刚好，耐冷，质量很好，做工也很精细，衣服大小正好合适，手感也不错，保暖效果真的
12	0.03, 0.65, 0.03	假货，假货，假货，重要的事情说三遍，商标还没穿就掉了一大块
18	0.0, 0.99, 0.0	衣服上身很舒服，质量很好，做工很精细，穿出去都说好看，满意哦
18	0.0, 1.0, 0.0	怎么这么
11	1.0, 0.0, 0.0	不错，喜欢，物流满分?，包装快递满分
3	1.0, 0.0, 0.0	尺码太小，买的比客服推荐还大了一码，结果还是小了。
2	1.0, 0.0, 0.0	秋衣秋裤套装，包装很好，物流快递服务态度很好，，穿上很舒服，很合身，质量很好，柔软，没有色差，，会推荐给朋
0	1.0, 0.0, 0.0	衣服很好，材质也很不错，店家推荐的尺码也很合适
7	1.0, 0.0, 0.0	非常合身，我.体重，给大家做个参考，好评
2	1.0, 0.0, 0.0	穿着身上痒，掉色严重，不建议购
6	1.0, 0.0, 0.0	衣服收到了，试穿了一下，大小合适，质量很好。洗了不褪色不变色
23	0.22, 0.53, 0.24	请努力提升质量
15	0.26, 0.74, 0.0	衣服很合身，每天晚上夜跑的时候都会穿
18	0.0, 1.0, 0.0	活动时入手性价比超
2,15	1.0, 0.0, 0.0|0.0, 0.98, 0.0	还能再差点吗？或者你把价格再降35元，试
0	1.0, 0.0, 0.0	不暖和、舒适度一
35	0.0, 0.0, 1.0	尺码大小：尺寸大小仓适，正合我意我身。做工细节：做工细节则完美无缺。材质手感：材质手感柔
35	0.0, 0.0, 1.0	刚到货，还没穿呢！但愿裤脚不变
0	1.0, 0.0, 0.0	感觉非常不错，感觉很给力，性价比超高，购物上京东，多快好
0	1.0, 0.0, 0.0	号不准，其他的 4x，这个需要
11	1.0, 0.0, 0.0	实物跟页面描述不符，太薄
11	1.0, 0.0, 0.0	收到了快递包裹，试穿上面料柔软很舒服，尺码大小也刚好合身
3	1.0, 0.0, 0.0	发货商品款式及尺码严重不一致。买的是黑色其他款式和码！售后服务质量很差，要求自己垫付，并且不是与京东快递捆绑合作。这么大的企业，品牌;
0	1.0, 0.0, 0.0	商品很好，商品很好，价格再便宜点就完美了，商品很好，商品很好，价格再便宜点就完美
6	1.0, 0.0, 0.0	保暖内衣看起来还不错，包装的很仔细，价格也非常公道，还会继续买买
30	0.0, 0.0, 1.0	买的号码很适合，质量很不错，手感很好，穿上凉凉的
3	1.0, 0.0, 0.0	质量挺好，穿着合适舒服，非常满意
35	0.0, 0.0, 1.0	材质比较薄，穿着先看看，不知道过段时间会不会松
18	0.0, 1.0, 0.0	真的很凉快！非常好穿，李宁大品牌就是不一样，真的，便宜十几块钱都有区别
6	1.0, 0.0, 0.0	裤子太
14	0.0, 0.95, 0.02	保暖衣摸着特别柔软，长度也刚好。洗了不起球不掉色，厚实保暖，
12	0.0, 0.96, 0.0	发货很快 第二天就收到了 质量很好 相信恒源祥的品质 100%棉 老公很满意 
35	0.0, 0.0, 1.0	质量一般，太薄了，买的加厚加绒的，回来一看也就直四五十，这还一
3	1.0, 0.0, 0.0	质量一般果然便宜没好
12	0.0, 0.99, 0.01	刚收到快递打开一看是脏
17	0.02, 0.56, 0.03	穿着还不错，很薄很凉
11	1.0, 0.0, 0.0	衣服非常好呜，家人穿着帅气呀，质感好，下次还光
11	1.0, 0.0, 0.0	很舒服，确实还是很好的衣服，质量不错的
23	0.24, 0.46, 0.3	质量很好，做工精致，服务态度极佳，物流也给力，很
10	1.0, 0.0, 0.0	换个货十天半个月
12	0.02, 0.83, 0.05	做工
12	0.03, 0.97, 0.0	很好，很耐穿，穿起来很舒
11	1.0, 0.0, 0.0	衣服收到了，是正品，在实体店看的要比这贵一倍，质量很好，卖家建议的尺码正好，水洗了一下，不掉色，不变形，准备再入手一
0	1.0, 0.0, 0.0	产品质量很好，很喜欢，长期使用，值得信赖，还会继续购
14,18	0.01, 0.97, 0.0|0.21, 0.54, 0.03	质量还
6	1.0, 0.0, 0.0	秋裤质量真不错，纯棉面料柔软舒服，做工精细，走线整齐，没有多余的线头，尺码也标准，特别是物流很快，头天下单，第二天就收到
0	1.0, 0.0, 0.0	这质量是真垃圾，比不上我地摊上七八块买的内裤。#，贴牌
14	0.0, 0.98, 0.02	李宁大品牌值得信赖，服务态度很
18	0.05, 0.95, 0.0	感觉一般，穿上感觉舒适度一
6	1.0, 0.0, 0.0	很不错，建议大家购
14	0.01, 0.99, 0.01	鞋底防滑耐磨啦，这款鞋子相当不错，没有任何异味呵，非常百搭吆，质量好
18	0.13, 0.69, 0.0	怀疑是不是正品，还没穿几次，胸前的李宁标识就全掉了
18	0.22, 0.72, 0.05	穿起来挺舒服的，也没什么异味，已经多次购
17	0.27, 0.42, 0.05	摸起来像是免得，没有色差，挺好看的京东退换货方便，买东西比较放心，送****很贴心，质量有保障一般快递5天，京东自营物流很
6	1.0, 0.0, 0.0	穿了一段时间也没仔细看，前两天洗衣服才发现，上衣下部缝合线一团糟，多处线头，有很长一段都是乱线缝合的，见图。没想到品牌衣服也有这种低级错误
24	0.0, 0.0, 1.0	一般，没有超市买的好，样子像是贴牌的，还褪色，价格算便宜懒得退
15	0.02, 0.98, 0.0	快递还没有拆开，就看这个包装这个衣服质量也是啥也不是太差了，假李宁虽然价格便宜也不知道包的这么简陋就发过来吧，扯淡呢，不穿了直接进垃圾
15	0.1, 0.84, 0.0	明知道白色容易脏，我还是贱兮兮的买了白色的。穿起来很舒
35	0.0, 0.0, 1.0	一如既往的优秀，发货速度快，衣服质量好，活动价的时候买的，物美价廉，老公试了一下非常满
23	0.26, 0.43, 0.31	保暖裤子收到了，非常的厚实，天气冷了买来保暖的，非常的暖和一点都不冷了，非常不错的一款保
30	0.0, 0.0, 1.0	还不错，快递很快就送到了，性价比挺高的，穿起来比较舒服。样式也还可以，还会回
23	0.24, 0.47, 0.28	包装不密封，随意可打开包装盒。贴身衣物应包装
18	0.33, 0.66, 0.01	特别喜欢在京东买东西，质量好，物流速度快，而且要比超市便宜的多一直信赖京东，还会回购的，摸着质量也特别好，以后认准京
24,35	0.0, 0.0, 1.0|0.0, 0.0, 1.0	一直想买个薄款，结果还是给我发了厚款，没办法穿，只能给差评，和图案严重
35	0.0, 0.0, 1.0	从没想到这么大品牌居然还掉色，我的内衣也是新买的，和裤头就挂在一起了，结果干了我往回收的时候一看，内衣上很大一块蓝色，很失败的一次
27,29	0.0, 0.0, 1.0|0.0, 0.0, 1.0	尺码刚刚好，穿上打球很舒服，不会粘在身上
24,29	0.0, 0.0, 1.0|0.0, 0.0, 1.0	掉毛掉的厉害，买的红色的，整的外套，手上，地上全是红毛毛。价格也不便宜，质量怎么就这么
24,7	0.0, 0.0, 1.0|1.0, 0.0, 0.0	大家不要买他家的东西，我之前都是在~上买的内裤，尺寸大小都合适。第一次在京东上买，尺寸小了还不给退换货，服务相当差
35	0.0, 0.0, 1.0	穿了一个多月，擦**还有那种绒毛，内裤
24	0.0, 0.0, 1.0	很薄，比秋衣略微厚
30	0.0, 0.0, 1.0	商品收到了，   由于还没有入冬，只是提前准备，但我比较相信恒源祥品牌，这也是我购买的第三套恒源祥商品了，还没有上身，先五星好评
30	0.0, 0.0, 1.0	看看这烂东西，发过来就是
26,27	0.0, 0.0, 1.0|0.0, 0.0, 1.0	纯棉的，价格还是会比超市的便宜一些。送货也快。喜欢在京东上买东西，方便，快捷，价格也很实惠，不用自己去扛，跟实体店品质一样，特别
35	0.0, 0.0, 1.0	包装严谨完好无损，京东快递速度很快，价格实惠比实体店便宜一些，日期都是最新的。做工精细质量感觉不错，材质手感纯棉无疑，尺码标准大小正合适，保暖效果非常满意，这个冬天不怕冷
26,30	0.0, 0.0, 1.0|0.0, 0.0, 1.0	面料很舒服，柔软，凉快，白色穿着好看，显得干净，利落，老公很喜
24	0.0, 0.0, 1.0	到货就迫不及待打开了，果真没有让我失望，质量特别好，颜值也相当高，满意的一次购
26,35	0.0, 0.0, 1.0|0.0, 0.0, 1.0	性价比很高，很实惠，穿起来感觉很好，非常贴
35	0.0, 0.0, 1.0	给爸爸买的，穿着很
24	0.0, 0.0, 1.0	质量非常好，完全符合卖方的描述。我真的很喜欢。这完全超出了预期。交货速度非常快。包装非常仔细和紧密。物流公司有良好的服务态度，交货速度非常快。令人满意的购物质量非常好。我希望更多的朋友能信任它。店主的态度很好。我将再次拜访这位好卖家，以获得赞扬。交货很快，态度很好，我很满意！好，好！网上购物是如此快。我没想到商店的服务这么好，商品质量好，价格低，而且卖家非常热情。下次，我希望下次有机会在买。我祝你生意兴隆，质量好。我没想到包装会这么小心。下次我会有机会再找你购物。店主很好，东东很好。找到你心中的宝贝是一件非常开心的事。质量非常好，完全符合卖方的描述。我真的很喜欢。这完全超出了预期。交货速度非常快，包装非常仔细和紧凑，物流公司有良好的服务态度和快速交货
27	0.0, 0.0, 1.0	面料好，手感舒服，保暖效果不错，物
24	0.0, 0.0, 1.0	衣服收到了，质量顶呱呱非常
26,18	0.0, 0.0, 1.0|0.01, 0.9, 0.02	质量很差很薄不建议大家买，也就是20-30的货，这就是京东自营
24,26	0.0, 0.0, 1.0|0.0, 0.0, 1.0	材质很舒服，大小刚
30	0.0, 0.0, 1.0	内裤的话我只信赖恒源祥，以前自己没开始工作内裤一直都是妈妈买，懂事之后自己赚钱之后就自己买了，一次偶然的机会买了一个品牌的内裤就一发不可收拾买内裤就买恒源祥穿起来很舒服好穿好脱谢谢恒源祥谢谢京东给了我这么好的
35	0.0, 0.0, 1.0	?发货很快，两三天就到了，这个颜色我很喜欢，性价比很高，非常ni
35	0.0, 0.0, 1.0	还可以，挺柔软的，夏天穿着也挺凉快的，颜色也不错，尺码也合适，我满意，谢
35	0.0, 0.0, 1.0	啊尺码大小：尺码大小合适，做工细节：做工细节良好。材质手感：材质手感柔顺。保暖效果：保暖效果良好厚薄程度：比薄的厚一点，比加绒的薄一点。透气效果：透气性良
24	0.0, 0.0, 1.0	很好的，买了好几次了，比实体店便宜的，哈哈哈哈哈哈
27	0.0, 0.0, 1.0	衣服收到了，看着很厚实，质量很好，面料摸着柔软舒适，价格实惠，很
17	0.0, 0.54, 0.23	我只能说码不准我买的大的
26,30	0.0, 0.0, 1.0|0.0, 0.0, 1.0	非常棒的一套衣服，穿着很舒
12	0.01, 0.47, 0.06	单纯的夏款，比较
26,30	0.0, 0.0, 1.0|0.0, 0.0, 1.0	质量不错哦，面料很好，穿上很暖和，性价比
24	0.0, 0.0, 1.0	货不对，版垃圾骗人
35	0.0, 0.0, 1.0	给爸爸买的，穿上很合适，很喜欢呐?
30	0.0, 0.0, 1.0	实穿感受：很棒尺码大小：合适，上身效果不错，很舒服！非常有弹性
27	0.0, 0.0, 1.0	买给老公穿，质量和做工细节都不错，面料舒服保暖，老公挺喜
35	0.0, 0.0, 1.0	很好，穿上很运动，效果不错的，很喜欢。关键是很便宜哦！！！！！！！建议购买，总不是穿一个夏天，买好的也就一个夏天，后面都不好穿
30,35	0.0, 0.0, 1.0|0.0, 0.0, 1.0	太
24	0.0, 0.0, 1.0	内衣保暖效果还可以，但是厚度没有宣传的
